overall,verified,reviewTime,reviewerID,asin,reviewerName,reviewText,summary,unixReviewTime,style.Size:,style.Color:,vote,image,style.Metal Type:,,,
5,TRUE,"12 10, 2007",AZQSLT9YQPHRV,B0006HB4XE,Carol S. Citty,"Even though I got this chain as a replacement for a rather ""basic"" chain for a pendant, I think it would be great by itself.

I like that it came in a box, too. Some chains I have ordered from other places have just given me a pouch, or even a plastic zip-loc bag.

Definite quality here, I fully recommend it.","Great chain,",1197244800,,,,,,,,
5,TRUE,"12 9, 2007",A2RISJH0IL6YTZ,B0006HB4XE,Kris,The necklace is beautiful! It is very sturdy and exceeded my expectations! You CANNOT find a quality necklace like this anwhere for the price! A must buy!,Sterling Silver Box Chain,1197158400,,,6,,,,,
5,TRUE,"12 6, 2007",A3TTV1UZIZRU8L,B0006HB4XE,Linda B. Monks,"Silver Box link chain.  I bought this chain at first for the length. 22"". Most chains only come in 24"" or shorter.  This was a very good buy on my part because the chain is really attractive and sturdy enough to hold the pendant that I wanted it for.  In fact, the pendant looks even better now with this attractive chain. I should have bought more. The price was so reasonable. I am going to order a few more to have on hand. For myself or a gift item.  Very pleased. Quick shipping too!!  Thankyou, Linda from New Jersey",Good Value,1196899200,,,,,,,,
5,TRUE,"12 5, 2007",A1K2E0FY4DAUZ4,B0006HB4XE,FloridaSunshine,"I bought several of these in various lengths for gift pendants and every one was a winner. The silver is bright and shiny, the link is sturdy but looks just right for a pendant. The ring clasp seems strong and every one worked smoothly. These were shipped superfast and well packaged. I checked prices in my local ""big box"" store and these are better chains at a lower price even with shipping.  I am definitely a happy customer.",Great chain at a great price,1196812800,,,,,,,,
5,TRUE,"12 4, 2007",A1O7GH6VD74HBJ,B0006HB4XE,M. Sneary,This necklace is delicate looking without being so thin that it will easily break. It's lovely.,Pretty and delicate,1196726400,,,,,,,,
5,TRUE,"03 22, 2017",A3UXSY1W3CJHZO,B0007MV6PO,Book Reader,This my second Henschel Hat of similar design.  I sure it will give me the same fine service as the first.,I sure it will give me the same fine service as the first,1490140800,,,,,,,,
4,TRUE,"11 5, 2016",A1S8052H93QN1E,B0007MV6PO,Robert Johnson,"good fit, great for keeping the sun off your head",Four Stars,1478304000,,,,,,,,
4,TRUE,"11 3, 2016",AHKYTLFWI4SN0,B0007MV6PO,kerry stoltzfus,Good fit and good price.,Four Stars,1478131200,,,,,,,,
5,TRUE,"09 21, 2016",AWM1NRL0LS7RU,B0007MV6PO,Amazon Customer,Great fit and feel,Great hat,1474416000,,,,,,,,
4,TRUE,"08 22, 2016",AT99Z9HO3V2LF,B0007MV6PO,Cornell M.,I use the hat for golfing.  Its perfect.,Great Hat,1471824000,,,,,,,,
5,TRUE,"08 21, 2016",AOMOVR532SY9L,B0007MV6PO,Amazon Customer,"This is my second Henschel hat. Ordered the same one that I bought years ago in Las Vegas. My old one is dirty from gardening, so wanted a new ""dinner"" hat. I have many hats...this is my fave. Thanks, Carter.",Best hat in the world!,1471737600,,,,,,,,
1,TRUE,"08 10, 2016",A4J60G8TA6LY2,B0007MV6PO,Gary,The small hat was too small and the medium hat was too large...disappointed since I liked the style,disappointed since I liked the,1470787200,,,,,,,,
5,TRUE,"06 07, 2016",A2UWA7WE25DQTC,B0007MV6PO,Russ Mcmanus,Tested it out in gale force wind while flying my rc models and I did not even use the chin strap and it is COOL on  the head. and perfect fit.,... not even use the chin strap and it is COOL on the head,1465257600,,,,,,,,
4,TRUE,"05 22, 2016",A3KXMVQG816KN1,B0007MV6PO,Amazon Customer,I have several Henschel hats and they all fit perfect as a medium size. For some reason this one is almost to tight. The hat is great and is cooler than any hat I own for working in the garden and yard. Hopefully it will stretch just a little bit for more comfort. I know a large would be to big so I will live with it.,Great hat but sizing is questionable,1463875200,,,,,,,,
5,TRUE,"02 15, 2016",A142I58UV9R80F,B0007MV6PO,Joseph,Very nice for cutting yards with. Thank you,Five Stars,1455494400,,,,,,,,
4,TRUE,"09 16, 2015",A10QJL1F3ALY0H,B0007MV6PO,Jacqueline D. Watson,"My husband had this hat but lost it on a recent trip.  Inadvertently ordered ""medium"" instead of ""large"".  Have returned the hat and will place a new order in Large size.","Great hat, ordered wrong size.",1442361600,,,,,,,,
4,TRUE,"09 12, 2015",A193PGCZL3E9OX,B0007MV6PO,Big Dale,my purchase was way too small.  I have an older one of these and ordered the same size.  This one was a size or two too small.,my purchase was way too small. I have an ...,1442016000,,,,,,,,
5,TRUE,"09 09, 2015",A2PVLXOIMGNBJ2,B0007MV6PO,Stefan7,I had to return and get a Large.,Five Stars,1441756800,,,,,,,,
5,TRUE,"08 16, 2015",A139GQ6FYMJRGZ,B0007MV6PO,Danny Foss,Thank you it's great.,Five Stars,1439683200,,,,,,,,
3,TRUE,"08 11, 2015",A1GN50FFT54V5F,B0007MV6PO,Deborah A. G,This hat is great looking but ran small.,Size issues,1439251200,,,,,,,,
5,TRUE,"07 30, 2015",A3AFC48SGX1YDV,B0007MV6PO,Babaran,My husband loves it!,Five Stars,1438214400,,,,,,,,
5,TRUE,"07 21, 2015",A22D0LAY0649D8,B0007MV6PO,Barbara A Archer,Thrilled to find this hat!!  PERFECT for Summer!!  Love it!!!,Awesome hat!!,1437436800,,,,,,,,
5,TRUE,"07 18, 2015",A2BVPIYZQEF6AF,B0007MV6PO,d jimenez,"hubby loves it. he has two, one for the yard and one for going out.",Five Stars,1437177600,,,,,,,,
5,TRUE,"07 10, 2015",AOEN8ZE376CRV,B0007MV6PO,AJ,"Great hat...!  I am a size 6 7/8th and the Medium fits perfectly.
Cool looking too...!",Just Right...!,1436486400,,,,,,,,
4,TRUE,"07 05, 2015",A13WSPLV4KISP9,B0007MV6PO,Matthew H Hampton,Normally I wear a large hat size.  Based on some reviews that stated the sizing ran large I ordered the medium.  Not a good move since sizing appears accurate - Medium means medium.  Returned the hat to the seller (postage expensive) who exchanged the hat immediately.  Replacement fit well & looks good per my wife.  Hopefully will work well at the ocean.,Purchase your normal size,1436054400,,,,,,,,
4,TRUE,"06 28, 2015",AKAXBRSQ3DCWC,B0007MV6PO,Rain&amp,amp,Snow,good looking hat I like it a lot keeps the sun off.,Four Stars,1435449600,,,,,,
5,TRUE,"06 14, 2015",A2GD28V2OARXHK,B0007MV6PO,DLW,"I bought a Medium.  Fits snugly.  Tried a friend's ""large"".  Too big.  Better to be 'snug' which helps keep it on in moderate winds.",Better to be 'snug' which helps keep it on in ...,1434240000,,,,,,,,
5,TRUE,"06 11, 2015",AQG16QCMT344N,B0007MV6PO,Lori Nelson,"We gave this to an elder farmer friend and he loves it.  The netting on the top lets the heat vent out, The chin string keeps the hat securely in place while he's cutting hay. And, best of all, it protects his balding head, neck, and ears from the sun's harmful rays.","Great hat for fishing and farming, and looks sharp too.",1433980800,,,,,,,,
5,TRUE,"06 08, 2015",A273H7VRY8ZFI9,B0007MV6PO,WILLIAM ANDERSON,Really a nice cool hat. Perfect for out in the sun or in the pool. Washes up very easily.,Excellent cool hat.,1433721600,,,,,,,,
5,TRUE,"06 03, 2015",APQN8K9U2U0S0,B0007MV6PO,Frank Jerome,The CoolMax Band works great. I did apply some leather softener to the string to make it less stiff.,Love this hat.,1433289600,,,,,,,,
1,TRUE,"06 01, 2015",A3IHG8Q9TVADVL,B0007MV6PO,MSal,Too small.,One Star,1433116800,,,,,,,,
5,TRUE,"05 20, 2015",A2WW78POMQJ4CT,B0007MV6PO,Bradley Smith,"This hat is just what I hoped it would be.  The top and brim are solid, providing sun protection, but the mesh allows for air circulation to keep your head cool.  It's almost identical to the Henschel khaki hat, but this one also has mesh covering the brim, giving it a different style.  Originally thought the cord was unnecessary,  but while golfing in a very strong breeze I had to use the cord to keep the hat from blowing off my head.  The cord goes around the back of the hat when not in use.",but the mesh allows for air circulation to keep your head cool. It's almost identical to the Henschel khaki hat,1432080000,,,,,,,,
1,TRUE,"05 10, 2015",A36UJDARHQ7605,B0007MV6PO,timothy spangler,Girls like it u wl 2,One Star,1431216000,,,,,,,,
5,TRUE,"05 04, 2015",A1DBFR968FXHA7,B0007MV6PO,michael buckley,Awesome hat,Great hat,1430697600,,,,,,,,
4,TRUE,"04 30, 2015",AQTV5RKYXN7MM,B0007MV6PO,Barry Litt,Liked the hat but medium was a bit too tight.  Plan to get next size up even though measured 7 1/8.,Liked the hat but needed next size up,1430352000,,,,,,,,
5,TRUE,"04 29, 2015",A19OVKJBWQ24B5,B0007MV6PO,dk60,This hat will be great in hot weather.,Five Stars,1430265600,,,,,,,,
3,TRUE,"04 18, 2015",A8FCCR20SDQF7,B0007MV6PO,Kindle Customer,"I got two of them, one fits fine the other is a large, the size states med but it fits my wife and she has a hat size of large, thus I would say that the label was wrong or QA issue in making the hat sizes consistence.  Looks more like the label than anything else, but this is also a QA issue.

So one fits fine the other is to large, gave it to may wife.",one fits fine the other is a large,1429315200,,,,,,,,
4,TRUE,"10 15, 2014",A2YDLXFKH2V3LX,B0007MV6PO,The Sylvans,"Nice hat - choose your size carefully.  Also, it is somewhat ""packable"" but gets some creases.",Four Stars,1413331200,,,,,,,,
5,TRUE,"10 14, 2014",A115TBXRPREL69,B0007MV6PO,geolat,"The fit is as I expected as it's not my first Henschel hat. I like a,nd use the strap. With a wide brim it does like to move in the wind.",Fits right,1413244800,,,,,,,,
5,FALSE,"10 5, 2014",AJA4E6BZUSZ7V,B0007MV6PO,millrat,great quality,Five Stars,1412467200,,,,,,,,
5,TRUE,"09 25, 2014",A333P4ZQ6VJESC,B0007MV6PO,excited,"I love my Aussie hat.  It looks expensive, but it's not!  It's made very sturdy.  Should last me a long time!",I love my Aussie hat,1411603200,,,,,,,,
4,TRUE,"09 23, 2014",A1D74AK6016RP2,B0007MV6PO,Jim Coldren,I read other reviews that these hats run on the large side so I ordered the next size down. It was too small and I should've ordered the standard size. I was able to stretch it out with some water and a small bucket and it fits fine now. It is a great hat!,Sizing,1411430400,,,,,,,,
5,TRUE,"09 16, 2014",A3ABB4IV2721ID,B0007MV6PO,hikerdude,"This hat has been perfect for me.  I've used it on many high altitude hikes, and around the house working!  The mesh at the top keeps me very cool and comfortable.  I will buy another one and recommend it to all of my friends",outstanding hat,1410825600,,,,,,,,
5,FALSE,"08 24, 2014",A2CNOL3QF3QZYN,B0007MV6PO,Sandra G.,"I really like this hat for the price!  It fits well, and I like the fabric (it looks good and it is crushable).  Also, it is a hat with a chin strap, which is important to me, it keeps it from flying away.  I would recommend this hat!",I really like this hat for the price,1408838400,,,,,,,,
5,TRUE,"08 23, 2014",A30S6ZSSYANKC0,B0007MV6PO,Coleminer,This hat fits well and was received in just a few days.  It is just what I have been looking for.,This hat fits well and was received in just a ...,1408752000,,,,,,,,
4,TRUE,"08 16, 2014",A35NXU05TYKTTF,B0007MV6PO,Sea View,"I love this hat. It protects me from the sun, and looks good doing it. Even after being thrown into my suitcase it comes out and looks good on my head.",Good Value.,1408147200,,,,,,,,
5,TRUE,"08 06, 2014",A2XNZTWALWIKYZ,B0007MV6PO,Suzy,Great hat for walking in the desert or working in the back yard in southern Nevada . . . Take off the leather strap - don't need it.,Great hat for walking in the desert or working in ...,1407283200,,,,,,,,
5,TRUE,"07 28, 2014",A27X1Z8FG5CACE,B0007MV6PO,Kindle Customer,"Hat is just what I needed/wanted.  Fits fine, like the stiffer brim which doesn't flop.",5 stars,1406505600,,,,,,,,
4,FALSE,"07 18, 2014",A3N2XVPCDJRP56,B0007MV6PO,Larry,"The hat is great and it was delivered on time and packed perfectly.  However, I ordered a MED size based on the reviewers comments that it was sized large.  I wear between a 7 1/8 and 7 1/4 so my experiece says go with the larger of the 2 if you are in between sizes.  It is a great hat and I will reorder a Large when it is in stock.",Great hat but size was wrong,1405641600,,,,,,,,
4,TRUE,"07 12, 2014",A2Z8LAZAAQ087K,B0007MV6PO,MJ,Nicely made but I'll have to wear a bandana under it-it runs a bit big,Four Stars,1405123200,,,,,,,,
5,TRUE,"07 12, 2014",AUAO3539V55RT,B0007MV6PO,Jolie,"I find myself just loving these hats,  I've  written quite a few reviews of many Henschels that I have.  For me, they are well worth it; comfort, style, practical, and well made.  All you have to do is try one or two or three!!!  CoolMax band is unique and adds to comfort, I am from Louisiana, and there is no shortness of heat and humidity here.",Practical and Stylish,1405123200,,,,,,,,
4,TRUE,"07 11, 2014",A3MHIIX9FO5R6N,B0007MV6PO,Marcia L. Stoutamire,"I think the hat was a nice quality, especially for the price.  I was disappointed that it took a little longer than I expected for it to arrive.  And, I ordered a size smaller because most of the reviews I read said that it ran small.  It definitely did NOT run small!  I had to return it because it was way too small.  I would say that it actually ran very true to size based on my experience.",Nice hat! but don't believe the statements that it runs small!,1405036800,,,,,,,,
5,TRUE,"07 10, 2014",A1LX721K9T5JR4,B0007MV6PO,Seaman,This hat is great for Summer.  My husband had one and he liked it so well that I ordered myself one.,Great for Summer,1404950400,,,,,,,,
5,FALSE,"06 30, 2014",A3LWCHIKJRH0X7,B0007MV6PO,Carinne Wolford,Fantastic hat and can stuff it in tight places.,Five Stars,1404086400,,,,,,,,
5,TRUE,"06 19, 2014",A15FOOR5ZU3ZG9,B0007MV6PO,Marshall T Snodgrass,This hat is ideal for our vineyard work.  It has a wide brim and allows for some cooling with the mesh crown.,perfect for working in the vineyard,1403136000,,,,,,,,
5,TRUE,"06 15, 2014",A1L8BUO5BV2922,B0007MV6PO,DARLENE STETLER,"Bought for my sweetie for his birthday.  He works outside in florida so the sweat band is great, he loved it.

Thanks.",Great fit,1402790400,,,,,,,,
2,TRUE,"06 06, 2014",A22CFRHKCO7BFI,B0007MV6PO,N. Riehl,"We bought this for my husband. He wears a 7 1/8 hat. He could not even get this hat on. Otherwise, it looks like a nice product.

Update: Work Wear Savings, the company through which the hat was purchased, sent me a return label the same day I called to say the hat was too small. They would send me a large hat when the other had arrived at their returns dept. After over 2 weeks, I had not had any email update. I called the company, learned they had received the returned hat, but that a large hat would not be available until July 14. My complaint: Why did they or Amazon not notify me by email? I do not feel I've gotten good customer service.",Sizing is small,1402012800,,,,,,,,
5,TRUE,"04 25, 2014",A2HJKQ8B9UFC0V,B0007MV6PO,Barry,"Needed wider brim hat than floppy had been wearing. This hat was cheap enough to abuse and has held up well. My work requires Sunup to dark in  100 degree plus. Hat ends up under gear, on floor of truck or blowing across log yard. Would buy again, well made, pretty good fit, maybe just a little tight but not much. Don't know how it looks, don't care, don't walk around with a mirror. Don't  work in a city.",Sierra Nevada's Log Scaler,1398384000,,,,,,,,
5,TRUE,"04 04, 2014",A2QFEQ7MYB7ZUG,B0007MV6PO,Loretta,"What a great hat.  I looked and looked, and finally decided on this hat.  I wore it in Egypt and it was great.  Folded in my suitcase and my backpack.  Fit perfectly and had great breezy area so my head kept cool....and I looked cute!  Love it.  Bought one for my friend to wear also.  She loved it, too.","Love, Love, Love this hat",1396569600,,,,,,,,
5,TRUE,"01 25, 2014",AEUBIN8VUBABD,B0007MV6PO,VT buyer,"He loves it!  He wears it to mow grass, garden and to fish.  Well made, airy and covers the ears which prevents those sunburned ears.",My son's hat,1390608000,,,,,,,,
5,TRUE,"11 22, 2013",A2GD9XGLO75GVY,B0007MV6PO,HDSpringerLady,"I gave this 5 stars because it's a great item.  I bought it for my BF to do yardwork.  He's had it about 3 years now and it's still in great shape.  As a matter of fact, he wants another if I could just find it in blue.  It's easy to clean too. Just drop it in the kitchen sink and clean it up.",Great Hat,1385078400,,,,,,,,
5,TRUE,"11 1, 2013",A2DU4XRMEUN53K,B0007MV6PO,Calico gal,"I am always nagging my husband to wear a hat to protect him from the sun.  He is very picky about what he's willing to be seen in.  He's always been a boater and since this hat was designed for just that it was an instant hit for him.  It's lightweight, stylish and we even packed it in a suitcase and he used it traveling.  Every time we took it out of the suitcase it popped right back into shape.
Haven't tried washing it yet, but it is washable and that is a definite bonus!  Now we're both happy.",Perfect hat for my husband,1383264000,,,,,,,,
5,TRUE,"07 30, 2013",A2W19VXUMLAIRI,B0007MV6PO,Janet Nordhoff,"Very happy with transaction, and hat. Have had one before, and was very happy to purchase another, and will purchase again and again.",Great Hat,1375142400,,,,,,,,
5,TRUE,"07 20, 2013",AVJHA75J5XML5,B0007MV6PO,Amazoner,I did a fair amount of research for a good hat for golf without paying a huge price for it.  This hat is good quality and the price including shipping was fair and lower than anything else that I could find.  Plus I knew that Amazon would stand behind it.,Best price and quality,1374278400,,,,,,,,
5,TRUE,"06 14, 2013",A2VGKEZRRAQ8,B0007MV6PO,Amazon Customer,"This is the second Breezer hat I purchased in less than a week. The first hat came packaged perfectly and arrived in perfect shape. The second hat, this one, not so good. The hat was crushed. Yeah, yeah, I know, it's crushable. Nevertheless, it took some effort to return it to presentable shape. Otherwise, I love the hats. They fit well, nice shape, vent well, have a chin strap to keep it on in Kansas winds. Good product. I just wish you could count on the packaging. Oh, well, if these last as long as think they will I won't be buying another for quite a while.",Henschel hat,1371168000,,,,,,,,
5,TRUE,"06 10, 2013",A24G2J177JC1OE,B0007MV6PO,Maggie LeBlanc,This is a good light weight hat that allows for good air flow while protecting from the sun. I like the strap that can be functional or put behind ears on on hat as in picture.,What I was looking for,1370822400,,,,,,,,
5,TRUE,"07 30, 2012",A1U1MBKUK4ALUW,B0007MV6PO,Alten,"The Henschel hat I received was a perfect fit and every thing I could hope for. It's just what I needed for protection from the sun on the golf course' where I play almost every day.

Thank you for the quick service and a wonderful product.

Allen A
Ark.",Sarisfied,1343606400,,,,,,,,
4,TRUE,"06 18, 2012",AD9XTLPJM994X,B0007MV6PO,LMB,Quite pleased with the Breezer - with a slight breeze and a little sweat on your hair it really does feel quite cool.  The size medium will fit a 7-1/8 but it's on the snug side.,A summer hat worth the money,1339977600,,,,,,,,
5,TRUE,"04 24, 2012",A3PWA3SF2LWYRV,B0007MV6PO,Glen H. Hawkins,"without telling my age,I'll just say that I've worn a lot hats and caps in my time.  From my youthful days in the cotton fields to now enjoying my retirement.  I must say that without a doubt this is the most comfortable, and definitely the coolest hat I've ever worn. Love the CoolMax headband.  Plus if you get dirt on it as I did, picking it up with dirty gloves on, It's easy to clean.  I used a wet soft bristle tooth brush with a little mild detergent, brushed the dirt away and let it air dry.
  I highly reccomend this hat for anyone.
Plus my wife says I really look good with it on!  Doesn't get any better than that!!",A cool Breeze,1335225600,,,,,,,,
5,TRUE,"08 24, 2011",A3SRWCHQ8NHWXJ,B0007MV6PO,happy will,"This hat is great.  It provides shade for the ears and eyes.  It is comfortabe even on the hottest days because the top venilates the head.  My skin doctor encourged me to get a hat like this because I have had some skin cancer on my ear. Lastly, the price is right.",Comfortable hat,1314144000,,,,,,,,
5,TRUE,"06 23, 2011",A2UB4DPOIKY1JL,B0007MV6PO,E.A.A.,"Bought this hat to use out in the yard when doing yard work to block the sun. It works just as I hoped it would, A quality hat that fits nice and snug and does not blow off in the wind.  Has a large brim to block the sun off the ears and back of the neck and your head still breaths with the mesh top. I would rcommend this hat. Did not understand, why UPS shipped it to the US Post Office and then the post office delivered it to my home. Waisted a day on delivery when UPS could of dilerved it the the house, which, by the way was not shipped for free!",Sun Hat,1308787200,,,,,,,,
4,FALSE,"11 14, 2010",A8UJCO5CH0ZOS,B0007MV6PO,JarCie,You can't beat Henschel for well made and reasonably priced headgear.  I have two of their breezer hats I wear for sun protection and both are great.,Nice Hat,1289692800,,,,,,,,
5,TRUE,"08 22, 2010",A32T83AHSEPXYA,B0007MV6PO,J. Lin,"The material quality was good and the style was nice. However the hat was out of shape when I opened the box. It was also a little tight. Checking their return policy I found that I would have to pay for the return shipping fee which was almost half the price of the hat itself. I decided to keep it as a working hat when I do my yard work. Few days later I received an email from their customer service asking me about how pleased I was with their product. I told them I wasn't pleased with the condition of the hat, but decided not to return due to high return shipping fee. To my surprise they sent me next day a prepaid UPS label with which I returned the hat requesting for an exchange. Yesterday I received the exchange. This time they packed the hat snuggly inside a box, which was packed inside another larger box with packing paper. Although it took long time to receive the exchange their customer service is superb. I will buy product(s) from them again in the future.",Nice Henschel Breezer hat,1282435200,,,,,,,,
1,TRUE,"08 18, 2010",A1VOUM3GXG806Z,B0007MV6PO,dude,"I ordered this item for a trip I was going on where I needed a hat that not only blocked the sun but was cool as well.  The item showed in stock,  several days later I was notified the item was on back log until the 17th.  I contacted the vendor and asked them if they could expedite the shipment with the vendor, something I do routinely with my customers.  I was told they'd try.  I contacted their vendor who told me they would be shipping the items to Sportsman on the 13th.  I contact Sportsman indicating I would be leaving on the 21st and needed the item delivered the 20th and if they couldn't promise that delivery to cancel the order if it hadn't shipped by the 17th.

On the evening of the 17th they called and asked if I still wanted the item,  yes but i need it the 20th.  No problem  -- today i get a shipment notice indicating the item will be delivered the 23rd 2 days after i leave.  I don't know if i'll get the item before I leave but to pay 30% of the items cost and be told they cannot expedite the freight after they advertised it as a stock item is poor service, based upon the support i've received i'm not sure i'll be a return customer.

disappointed with amazon and sportsman for not factually indicating the stock status of item,  I understand that their computer systems may not be up to date but you don't find that out until after you place your order, and honestly I have had good experiences with Amazon until now.  But with this vendor the experience has been less than what I expect from Amazon on an item that was ordered almost 2 weeks before I needed it.",Service leaves much to be desired,1282089600,,,,,,,,
5,TRUE,"05 26, 2010",A134CHT1R8UXZL,B0007MV6PO,C. Jerry Walker,"Just what I wanted.  A little pricey but still it is what I wanted, so what the heck.  A good deal.",outdoor hats,1274832000,,,,,,,,
5,TRUE,"10 26, 2009",A25OQC0HX0IYEV,B0007MV6PO,E. Blackler,"This hat is perfect for sun protection in a windy situation.  It will also keep my head cool in warmer weather.  I am pleased with how it looks, and that it is packable.",Just the right hat,1256515200,,,,,,,,
5,TRUE,"10 14, 2009",AGO0ZKEV63X8N,B0007MV6PO,RT,"Ordered this hat because every other hat I had made my head sweat, that ran into my eyes when hiking. This hat works great, beyond expectations. Made in the U.S.A. makes it perfect. Sizing for me was right on.",Henschel Breezer Hat,1255478400,,,,,,,,
5,TRUE,"10 11, 2009",AOIU7KDMKYDTC,B0007MV6PO,Daisy May,"My husband only wore baseball cap style hats.  I was thrilled that he really likes this hat and now wears it all the time, and it looks great on him.  Plus, it covers his ears from sun damage, a common place for men to get skin cancer.",Great Hat!! Great Deal!!  Love that it's from STL,1255219200,,,,,,,,
5,FALSE,"05 03, 2009",AZMQ2ILHDF519,B0007MV6PO,J. Dever,Yes it is nice and the mesh allows the wind to cool your head.  Can't wait for the 137 degree summer.,Too Cool,1241308800,,,,,,,,
5,TRUE,"04 04, 2013",A27JRBA42PY5ES,B0007MV6Q8,N. Tillery,"My husband loves this hat.  We have bought him one a year for the last five years.  He works outside, this hat gives him the protection he needs yet it is still cool with the vented top.",Great hat,1365033600,,,,,,,,
5,TRUE,"03 18, 2013",A11SCKXOA73530,B0007MV6Q8,NV,This is just what I was hoping to get. It is cool inside and lets air flow through. It looks nice and the cord can be tightened to prevent it from blowing off when windy.,Great hat!,1363564800,,,,,,,,
