overall,verified,reviewTime,reviewerID,asin,reviewerName,reviewText,summary,unixReviewTime,style.Size:,style.Color:,vote,image,style.Metal Type:,,,
4,TRUE,"07 27, 2013",A12LN1UTGCPU4R,B00066G516,charily,I really like these socks. I didn't notice that they were nylon and not cotton.  I expect they will run just like hose.  I was planning on something more lasting.  But I do like the funky look with sneekers.,nylon,1374883200,One Size,Black,,,,,,
5,TRUE,"06 23, 2013",A1NWZPS4RXR8QA,B00066G516,Wifes Assistant,"My wife absolutely loves these classic lace ruffle anklet socks. Perfect for any schoolgirl outfit. Soft, sexy, comfortable and a reasonable price.",Sexy socks for the wife,1371945600,One Size,White,,,,,,
5,TRUE,"06 13, 2013",A9ULH4CW02IFW,B00066G516,Ms. Worth it,And all the compliments I get from other women my age who remember wearing them!  Great for wearing with a fun costume.,I have fun wearing them,1371081600,One Size,Black,,,,,,
5,TRUE,"04 09, 2013",A3BR9RZ9VSSVI6,B00066G516,Julie,"Used it for a show and it went quite well, really glitzy. Only drawback is that the color of my shoe's innersole rubbed off on it, so they got stained but bleached out fine.",Used it for a show,1365465600,One Size,White,,,,,,
2,TRUE,"03 17, 2013",A1RGJ76XJ39UX9,B00066G516,Graham Flanagan,"These socks are poorly made, not comfortable, and would I think work fine for a halloween costume but not much else.",Kinda cheesy,1363478400,One Size,White,,,,,,
4,TRUE,"12 9, 2012",AX2A7GLULBLJZ,B00066G516,Amazon Customer,"Purchased these socks as part of my halloween costume this year.  They are quite thin, but served their purpose!  Great price and free shipping!",halloween costume,1355011200,One Size,White,,,,,,
5,TRUE,"11 20, 2012",A1B7NHDRHNOZB,B00066G516,Brianna C. Fleury,"Nicely made socks. They look very cute, I get compliments on them all the time.  I still wear them even after the party was over.",Love them,1353369600,One Size,White,,,,,,
4,TRUE,"10 30, 2012",A2QPR1TJUJNOQ0,B00066G516,AZThinker,"These were a very cute compliment to a Halloween custom.  They are made from thick stocking material and are opaque, but run a bit large on a size 7 foot.  The lace also has a connection point at the back, but it's not visible.  They are definitely a good find at the price they were listed for.","Very cute, a bit over-sized",1351555200,One Size,White,,,,,,
5,FALSE,"10 22, 2012",A3M3OSBJKP9L5M,B00066G516,Shnelly13,These are super cute and very comfortable. The lace isn't cheap looking and the fit is good. Great for pageant queen Halloween costumes!,Anklet ruffle socks,1350864000,One Size,White,,,,,,
5,TRUE,"10 15, 2012",A3N0V5NZL6673G,B00066G516,Epatri,"I was looking for this kind of socks to wear on my wedding day! And they are perfect, exactly what i was looking for!. Good quality, comfortable, good price and delivered on time!",perfect!!,1350259200,One Size,White,,,,,,
5,TRUE,"09 26, 2012",A3FGX1C7K18PD5,B00066G516,Matt,"I'm a sissy and these pretty socks are unmistakably sissy.  When a ""man"" wears these with heels and a skirt, he is an obvious sissyboy.  That's why I love these so much.  They are feminine and cute and they make any outfit stand out as just a little more adorable.",Sissy socks,1348617600,One Size,White,3,,,,,
5,FALSE,"11 6, 2007",A2XFOBF5JGHV5G,B0006HB4XE,D. A. Eckert,"This chain is beautiful and I was thrilled to find a 22"" length as it is not commonly found in stores.  I plan to use it to hold a charm holder and charms which I haven't been able to wear for some time because I couldn't find the length I wanted.",Beautiful,1194307200,,,,,,,,
5,FALSE,"11 5, 2007",A2YVVT4UQ9KXRC,B0006HB4XE,terrilovesbirds,This is a beautiful necklace.  My 14-year old wears it with a charm all the time, its very sturdy and a great value for the price.  It goes very well with any type of charm, very very pleased with this piece.,Beautiful!,1194220800,,,11,,,
5,TRUE,"10 13, 2007",A2UHKGCHGMW4S1,B0006HB4XE,Michael Greenberg,Good quality and great price. I added a silver charm and it made a great gift. I bookmarked your site so I can order more in the future.,silver chain necklace,1192233600,,,3,,,,,
5,TRUE,"10 5, 2007",A21YOCX94MRCTW,B0006HB4XE,L. Gipson,"This is a sturdy chain that's quite comfortable - I wear it 24/7 . Also, the price is much better  than I could find locally.",Good product great price,1191542400,,,22,,,,,
5,TRUE,"05 27, 2010",A2C4L1FKCS8IEK,B0006HB4XE,DJ Schroeder,"This is a beautiful chain. I have bought several of them in different lengths. I would recommend this chain
to anyone. You will not be disappointed.",Great value for the money!,1274918400,,,,,,,,
5,TRUE,"05 01, 2010",A1T6L7VLPWIOWI,B0006HB4XE,Heidi,Got 5 of these to go along with initial pendents I purchased for my bridesmaids. They were even more beautiful than they were in the picture. I can't wait to give it to them at my October wedding!,Beautiful!,1272672000,,,,,,,,
4,TRUE,"04 27, 2010",AU4JTVW0PJMEK,B0006HB4XE,R. Rahim,"This chain is pretty, looks nice and arrived on time. I would recommend this chain to everyone, Best as a gift or gesture for that special one. The price is reasonable, and can suit everyone.","Nice looking, shiny chain.",1272326400,,,,,,,,
5,TRUE,"04 26, 2010",A171U8PU5N4W7Q,B0006HB4XE,Cheri C. Fisher,"The chain is beautiful and very shiny.  It goes perfectly with the cross pendant I purchased for him for Valentines day. It doesn't pull on his hair, it is the perfect length and is stands out nicely with his work clothes.  I would reccommend this product to anyone!","Great product, my husband loves it",1272240000,,,,,,,,
5,TRUE,"04 21, 2010",A3AH4UI2CJCG8J,B0006HB4XE,E. Alleyne,"I was pleased with the quality of the chain, however based on the picture I thought it would be slightly thicker. All in all a very good buy.",Eve,1271808000,,,,,,,,
5,TRUE,"04 20, 2010",AT5HAK90AFCRA,B0006HB4XE,Amy M. Rogers,I bought two chains. One for my mother and mother in law to hold birthstone pendants I had purchased for them for mother's day. The chains are beautiful and go great with the pendants I chose. They came very quickly. So quickly in fact that I may just buy another one for my grandmother for mother's day.,Awesome,1271721600,,,,,,,,
5,TRUE,"04 15, 2010",AO8YX3UPDK25M,B0006HB4XE,Alex One,"There are somethings that I just wouldn't ordinarily order on-line and jewelery is one of them.  I took a chance and ordered the Italian Box Link Chain Necklace, and I was blown away by the quality of the Sterling Silver chain that I received.  I looked around at several jewelers and for the money, you can't beat the price that this seller is offering, not to mention the fact that the item arrived way before I expected it in perfect condition!  I will buy from this seller again due to the quality of the necklace and the service.",Excellent Quality From Reliable Seller,1271289600,,,,,,,,
5,TRUE,"04 15, 2010",A1HBGH4J5XLDHL,B0006HB4XE,Amber Barlau,"I have been looking all over for silver necklace chains and could not find anything that would good enough.  So I decided to explore on Amazon and came across these.  As soon as I saw these and read the reviews from other customers, I knew they would be perfect!!  I just bought the charm part (a break in half big sis lil sis) of a necklace for my little sister who turns 12 next month so I was in need of getting necklace chains.  I received them in the expected arrival due date, in perfect condition!  I would GREATLY recommend this chain to any other individual who is looking to purchase a chain.  I could not ask for anything better!  Thank you!!",AMAZING!!,1271289600,,,,,,,,
5,TRUE,"04 12, 2010",AU8EUV2451CLO,B0006HB4XE,Jackie Kisting,This is a beautiful chain especially for the price.  I liked that I could order just the length I wanted and the service was first rate.  I will be buying from this company again!,Beautiful Chain,1271030400,,,,,,,,
5,TRUE,"04 02, 2010",A92JIDJABMJKY,B0006HB4XE,R. Thompson,"For what I paid this is a high quality chain for a great deal. It's important to me to have chains with different widths/lengths to choose from for my many pendants. This chain is sturdy, shiny and cleans easily (a plus for silver). Would definitely buy again :)",Fantastic Deal!,1270166400,,,,,,,,
5,TRUE,"03 29, 2010",A3REGQQY57X7M6,B0006HB4XE,James R. Kohler,"this is a beautiful box chain, bought it to go with a pendant I bought for my wife for our 40th wedding anniversary It looks perfect with pendant... Great product",beautiful box chain,1269820800,,,,,,,,
5,TRUE,"03 26, 2010",AG5ZSTZ05UJJB,B0006HB4XE,Edward J. Nie,I received that product as stated in the description within four days. The chain itself is very sturdy and looks fantastic. It was perfect for hanging a charm I had purchased for a friend. The clasp is strong and I would definitely recommend buying from Gem Avenue. I would make this purchase again.,Gem Avenue Sterling Silver 1MM necklace,1269561600,,,,,,,,
5,TRUE,"03 22, 2010",A1S14M7XSOK4DH,B0006HB4XE,M. Mardis,"This chain was very nice, delicated, yet strong. I Used it to hold a large pendent.  I like the look of the box link, and it is comfortable, not getting my hair caught in it.",Box Link sterling silver chain.,1269216000,,,,,,,,
5,TRUE,"03 15, 2010",A3I7I3SQYOWO2N,B0006HB4XE,Kelli M.,"These guys are great!! Last min. I had to contact the seller to change the size of my girlfriends necklace, and they did it so quickly. The response time was great.  Fast shipping!!! Came in a nice little box and my girlfriend love the necklace!! It looked so great on the charm that I got her!! She liked it alot and said that for the price we should get 3 or 4 next time!  It does not get tangled in her hair like the last necklace she had!! It looks great and it was nice and small!! Perfect for her nice charm!! This is a nice quality product and great shipping from the seller!! Thanks!! Grade A++++++++",UnBeLiVeaBle!!,1268611200,,,,,,,,
5,TRUE,"03 01, 2010",A38NDV764SRUWV,B0006HB4XE,Sandy R,"Ordered a 20"" and 22"".  Very nice quality, will order again.  Would definitely recommend",Nice quality,1267401600,,,,,,,,
5,TRUE,"02 21, 2010",A33WEAD17NL83,B0006HB4XE,DogLvr1116,"This is a great product.  I have never before seen chains of this quality for such low prices!  And even though the prices are low, the product is not cheap quality.  The chain is very pretty and durable.  I've had mine for a while now and I've not seen any visible wear or tarnish on it.  I exchange the chain between several different pendants and it works and looks great!  Highly recommend this product.",Great product,1266710400,,,,,,,,
5,TRUE,"02 19, 2010",A2OVYOC0OQVR92,B0006HB4XE,K. Wells,"I'm not sure what people are expecting when you pay less than $10 for a chain, but what I received were some delicate, beautiful chains meant to be worn for occasions with a pendant, not everyday rough use. Thanks for the timely shipping and nice product.",Great Product for the Price,1266537600,,,,,,,,
5,TRUE,"02 06, 2010",A4IF5DT2QAJUN,B0006HB4XE,Gretchen D. Klaber,the chains i received are very beautiful.  They came in separte packages.  Shipping was quick.,Sterling Silver Chains,1265414400,,,,,,,,
5,TRUE,"02 02, 2010",A3AIH5MTLM7X0K,B0006HB4XE,sarah shea,"I bought this necklace to go with a pendant I already had and I couldn't be happier with it!! I assumed because the price was so low that it would probably not be what I was looking for but I was pleasantly suprised when I opened the package! It is a beautiful chain and feels sturdy enough that I don't worry when I wear it to bed or to the gym! Anyone looking for a simple, sturdy chain should check this out!!",Great deal!,1265068800,,,,,,,,
5,TRUE,"02 02, 2010",AXLZKEIEO80W1,B0006HB4XE,Rae Mac,I love this necklace.  I needed a replacement chain for my favorite necklace and this has been perfect.  It's beautifual and I've gotten several compliments on it!,Perfect Necklace!,1265068800,,,,,,,,
5,TRUE,"01 30, 2010",A300TE8QYSTJUP,B0006HB4XE,Sally LHuillier,"I absolutely love this chain, and am extremely pleased with it. I also am pleased with the very fast and excellent service I received. I intend to buy more of these chains, for some pendants I have. They are an excellent buy!!",Sterling Silver chain,1264809600,,,,,,,,
5,TRUE,"01 28, 2010",A2KO01FP5KG2OX,B0006HB4XE,A. Spivy,"I needed a nice, inexpensive chain for a charm I received. This chain was beautiful and very sturdy. I was very pleased with every aspect of the chain.",Great Necklace!`,1264636800,,,,,,,,
5,TRUE,"01 28, 2010",AD82KTVHTQ0E2,B0006HB4XE,Movie Addict,"The chains were for my grand daughters, so I'm very picky about the quality.  They don't contain the harmful chemicals that are found in the extremely cheap chains, so I know their health will not be put in jeopardy.  The quality of these chains is excellent!  They are strong and very beautiful!  My grand daughters had some charms they wanted to wear and these chains are perfect! I will definitely purchase these chains again when needed!",Sterling Silver Chains,1264636800,,,,,,,,
5,TRUE,"01 17, 2010",A19FJWY800LAW7,B0006HB4XE,Amazon Customer,"I love this chain!  It's a super value and a very strong, good quality piece. I ordered one to replace a flimsy chain for a necklace/charm and loved it so much that I ordered another for myself and one for my mother.  There was a small problem with one clasp but the seller handled the return easily and swiftly.  I'll definitely purchase more of these box chains.",Great chain !,1263686400,,,,,,,,
5,FALSE,"01 16, 2010",AVFJ6CUTRYO2D,B0006HB4XE,M. Muex,I was very satisfied with this product and with the vendor.  I received just what I ordered and I received it in a very timely manner, much faster than I had anticipated.,Great Product,1263600000,,,,,,,
5,TRUE,"01 15, 2010",A1WZM8OGTZQWF4,B0006HB4XE,CLWise,My husband bought this chain for me.  It's lovely - and just the right size to add small charms.  I have bought several items from Gem Avenue and my experience has been great.  They sell quality merchandise and what you see is exactly what you get.,lovely chain,1263513600,,,,,,,,
2,TRUE,"01 14, 2010",A27V3GXARZO71Y,B0006HB4XE,Ann Alwin,"it seems like it's not the right size, and it's very delicate..i hope it doesn't break when my sister in law uses it, if it does, i will be letting you know.","1MM Italian Box Link Chain 16""",1263427200,,,2,,,,,
5,TRUE,"01 12, 2010",A5V68X0DBYZE2,B0006HB4XE,D. Schreiber,this was excellent. i purchased this chain for a pendent (also purchased from this seller) and it looked great. this made a great gift and my girlfriend loved it!,great product,1263254400,,,,,,,,
5,TRUE,"01 12, 2010",AVG2HQ4NAZ954,B0006HB4XE,Kat Hills,Chain is beautiful in person.  The picture does not give it justice.  All good experiences with this seller!,box link chain,1263254400,,,,,,,,
5,TRUE,"01 08, 2010",A100WAE3LAZOE6,B0006HB4XE,j.d,"I ordered this necklace for my mom for christmas and I was so surprised at how nice and shiny it was and just the overall quality of the necklace.  She has had issues with other necklaces breaking and this necklace she absolutely loves, it's very durable.  I would definitely recommend to anyone it's more beautiful than in the pics.",great necklace great value,1262908800,,,,,,,,
5,TRUE,"01 07, 2010",A276UCUE3U42XZ,B0006HB4XE,KZ,"I received a lovely necklace for Christmas, but wanted a slightly longer chain.  I was able to get a perfect match for the original chain in the length I needed.  It is beautiful, great quality.  It shines so beautifully.  I'm considering ordering another chain from this company just because they are so lovely.",Perfect,1262822400,,,,,,,,
5,TRUE,"01 06, 2010",AYDUBBA5UZOTI,B0006HB4XE,Michael K.,"My daughter just loves this necklace I got her.  Strong and durable.  To bad I'm not a better sizer, almost to tight for her neck.",Quality at its best,1262736000,,,,,,,,
5,TRUE,"01 05, 2010",ANCVHTM2SFT3P,B0006HB4XE,Anne E. Valentine,"These chains are lovely and an excellent value.  I bought them to replace the base metal chain that come with a religious medal.  It is a nice, strong chain.  Thanks!",Excellent value,1262649600,,,,,,,,
5,TRUE,"01 03, 2010",A3K6RZZ6KPOYWK,B0006HB4XE,CMonteagudo,"I recently bought an 18"" for myself... When I got it home, it was beautiful... Nice and sturdy, not thin at all. A very nice chain! I recommend this to everyone!",WOW!!!!!,1262476800,,,,,,,,
5,TRUE,"01 02, 2010",A3RZP2XIU4UQ30,B0006HB4XE,Margie,"I purchssed this chain to go with a beautiful cross I bought for my handicapped sister.  It is not only beautiful, but sturdy.  Thank you",Great Quality,1262390400,,,,,,,,
5,TRUE,"12 31, 2009",AACJV8YQKBU77,B0006HB4XE,elaine,I got this for my mom for Christmas and she loved it! I've order jewelry from this company before and they never disapoint!!,Mom loved it!!,1262217600,,,,,,,,
4,TRUE,"12 30, 2009",A1812S6JXS2MKY,B0006HB4XE,M. Yanta,I bought this chain to wear with my work outfits because of its simple and elegant design.  The necklace  was also available in a longer length which I prefer.  It works beautifully and I am pleased with my purchase.,Great for work,1262131200,,,,,,,,
5,TRUE,"12 30, 2009",A2L0FXRT2MDPMH,B0006HB4XE,Hill,"I bought three 14 inch chains for my granddaughter's birthstone charms.  The chains are flexible, shiny and easy for pre-teen girls to put on and take off.  I'd recommend these to anyone.",Beautiful Chains,1262131200,,,,,,,,
5,TRUE,"12 29, 2009",A3U8DLI28NPMRQ,B0006HB4XE,A. Juch,"I purchased one of these to go with a charm as a Christmas gift for my mother.  I ordered it rather late, but it arrived on time and she loves it.  It's good quality and I will most likely purchase one for myself sometime soon.",Excellent,1262044800,,,,,,,,
5,TRUE,"12 27, 2009",A1U2TORO5L4N1Q,B0006HB4XE,Frank Lange,"Looking to pick up replacement chain for my wife. Surprised by how cheap the price was....didn't know what to expect. Chain arrived and was perfect, much better quality than what was being replaced, and the clasp (which broke on the one being replaced) was high quality and easy to use. Extremely satisfied.",Great buy,1261872000,,,,,,,,
5,TRUE,"12 22, 2009",AHLKFQ6F7ZNWW,B0006HB4XE,JillyB,"I purchased this item for my daughter to wear with a charm picture of her son.  The chain makes the look.  It is of great quality and really makes the whole look expensive and well done.
<a data-hook=""product-link-linked"" class=""a-link-normal"" href=""/Sterling-Silver-1-MM-Italian-Box-Link-Chain-14-16-18-20-22-24-30-Necklace/dp/B0006HB4XE/ref=cm_cr_arp_d_rvw_txt?ie=UTF8"">Sterling Silver 1 MM Italian Box Link Chain 14"" 16"" 18"" 20"" 22"" 24"" 30"" Necklace</a>",Great quality,1261440000,,,,,,,,
5,TRUE,"12 18, 2009",A3LR6X4RHC8B7E,B0006HB4XE,Stachelschwein,"Ordered a 16"" chain and very happy with it. It's very thick and nice looking, definitely worth the price.",Love the chain,1261094400,,,,,,,,
5,TRUE,"12 15, 2009",A3UXS62M1R27KQ,B0006HB4XE,Mom from Louisiana,"These chains are better than I expected.  They are a nice weight and so brilliant they sparkle.  I bought four to place charms on for Christmas gifts, but will buy more when I need gifts in the future.",Beautiful,1260835200,,,,,,,,
5,TRUE,"12 15, 2009",A2LUTVD6CGQAFS,B0006HB4XE,ATL mom of 5,"i bought this necklace for my 6 year old daughter. it was her first necklace so i wanted something that would be durable for a very active little girl. She absolutely LOVES it!!! It holds up to sleeping in it AND playing with it on. She has 2 brothers and believe me they play hard, rolling around on the floor inside and the grass outside, jumping on the trampoline and all. We have had for a little bit now and it does not have a crinkle in it. Still looks as good as the day we bought it, and still shiny! I definitely recommend this necklace for anyone that is active and needs something to withstand day to day activities.",durable necklace,1260835200,,,,,,,,
5,TRUE,"12 13, 2009",A19DKZL5LXNSGI,B0006HB4XE,Janice M. Navarijo,"I ordered this chain to specifically use with a very beautiful sterling silver cross.  I was very pleased when I received it as it matched so closely with the cross you would swear it came with it.  It is made very well, the clasp is responsive and easy to open and close.  I am extremely happy with it and recommend it highly.  It can be worn alone, with other chains or, as I have done, worn with a very special cross, religious medal or other sterling silver pendants.",Perfection Plus,1260662400,,,,,,,,
5,TRUE,"12 12, 2009",A3QF8MZY67N2KP,B0006HB4XE,Ghost Writer 77,I haven't honestly gave it as a gift yet but it seems to be a great item. I bought it for my wife for Christmas. I am hoping that it all goes well.,Good Item,1260576000,,,,,,,,
5,TRUE,"12 12, 2009",A1YSV1BREMUE9X,B0006HB4XE,Jessica E. Visalli,I bought two of these chains and couldn't be more pleased.  They are beautiful in quality and they were shipped delicately and quickly.  This amazon seller is outstanding.  A pleasure to do business with.  I would recommend to anyone needing to make a jewelry purchase to do so with this seller.,Beautiful and a Bargain,1260576000,,,,,,,,
5,TRUE,"12 2, 2009",APZ8VCLDG03JH,B0006HB4XE,Jennifer Crowe,I bought this necklace for myslef because it is bright and it is noticed all the time.  It is durable as well.  It can hold some weight as well.  It stays bright.  Just the right length as well.  There is nothing negative that comes to mind about this necklace.  I will end up ordering more of these because I do need two more.,This Necklace,1259712000,,,,,,,,
5,TRUE,"11 27, 2009",A1V0PCO2NZNK4N,B0006HB4XE,Patricia J. Usher,"A very nice chain at a nice price too.  Bought for my daughter to put charm on; if she needs another, this is where I'll buy!",Nice chain,1259280000,,,,,,,,
5,TRUE,"11 24, 2009",A3V2U037IHGZNQ,B0006HB4XE,Midnight Writer,I bought this chain for a present.  It shipped and was received way before I expected.  It is sturdy and very nice for a man or woman.,Excellent chain,1259020800,,,,,,,,
5,TRUE,"11 16, 2009",AD8N1OYZ59Z7F,B0006HB4XE,Timothy J. Sample,"I've purchased 3 of 24"" Sterling Silver Necklace chains now from Gem Avenue. In each case I was replacing a much smaller chain. They are all high quality, in perfect condition and look wonderful. As a bonus, Gem Avenue was a pleaseure to buy fromas I received my product far quicker than they estimated.",Exactly what I needed!,1258329600,,,,,,,,
5,TRUE,"10 16, 2009",A2GXIG6I15DPZ9,B0006HB4XE,Alfredo J. Cintron,"Very nice chain, very shiny and a VERY good price. I don't think you'll be dissapointed.",Very nice,1255651200,,,,,,,,
5,TRUE,"10 1, 2009",A3605NZFP8LEM7,B0006HB4XE,Robin W. Griffin,"I was very Pleased with the necklace. Of course so much better looking than the photo can show. But it does a pretty good job of showing how pretty it is. Truly love the silver box that comes with. Makes it so nice & easy when gift giving, as I usually do. I will most certainly be purchasing more items. Thank you for your quality items. Robin Griffin.","Sterling Silver 1 MM Italian box link 20"" chain",1254355200,,,,,,,,
5,TRUE,"09 20, 2009",A1BNC6K8FAL44U,B0006HB4XE,watchersangelkitty,"I bought these to put pendents on for my children as part of our wedding ceremony. They are perfect weight and complimented the pendent perfectly. I bought 3 of these and they arrived quickly. Procrastination can be a downfall when ordering online. These came in just a few days. The silver boxes made it easy for me to ""marry"" the pendents with the chains and then put them back into the boxes to be presented on our wedding day.
Thank you",Wonderful gift,1253404800,,,,,,,,
5,TRUE,"09 11, 2009",A28JXJ8JXTGGOC,B0006HB4XE,Patricia A. Sulze,"I DIDN'T BUY THE CHAIN FOR MYSELF. I'M GIVING IT TO SOMEONE FOR CHRISTMAS WITH A
CHARM TO MAKE A PENDANT. SILVER CHAINS ARE EXPENSIVE AND I HAD ALREADY DONE MOST OF
MY CHRISTMAS SHOPPING FOR THIS PERSON ALL I WAS LACKING WAS A CHAIN. I SHOPPED ONLINE AND IT LOOKED LIKE I WOULD NOT BE ABLE TO GET HER A CHAIN TOO EXPENSIVE SO I FOUND THIS ONE AND BOUGHT IT. THANKS",BARGAIN PRICED,1252627200,,,,,,,,
5,TRUE,"09 11, 2009",A2Z1C8AVGH1X3J,B0006HB4XE,Deestar,"Gem Avenue was very prompt in their shipment and the price for the jewelry was very reasonable. The piece is what you would want, beautiful, but sturdy. I have confidence in Gem Avenue and would certainly shop there again, especially for large colored CZ jewelry, which I really enjoy. Everything from Gem Avenue has been gorgeous!",Quality and value.,1252627200,,,,,,,,
5,FALSE,"09 09, 2009",A1SBVE7H4FJ4X5,B0006HB4XE,Ember Reigns,"The only thing I can say I'd prefer different is a lobster clasp as this one is small and hard to put on with nails. But it is hands down the best price on a sterling silver quality chain and I will return to this seller for more items :) I cannot wear gold or platinum, as it turns my skin black on contact-so since I like quality, great silver and awesome buys always make me a very hapopy girl :) I recieved this as a gift and was very pleased :)","Great Silver, Great Price, Great S&H :)",1252454400,,,,,,,,
5,TRUE,"09 06, 2009",A2A27Q6J62APZ6,B0006HB4XE,George L. Buzzard,After buying this necklace I tried this on myself and found the ease it has of sliding it on and off when I need to do so. This necklace well designed and has real class. I highly recommend this to anyone in need of a necklace.,Good Fit,1252195200,,,,,,,,
5,TRUE,"09 01, 2009",ARCHYINVRKNX6,B0006HB4XE,Candi S,The picture does not show how pretty and delicate the necklace is. It looks very expensive. You can't find anything this nice for such a reasonable price in a store. LOVE IT!!,Great Value,1251763200,,,,,,,,
