overall,verified,reviewTime,reviewerID,asin,reviewerName,reviewText,summary,unixReviewTime,style.Size:,style.Color:,vote,image,style.Metal Type:,,,
5,TRUE,"07 20, 2014",A2CPXT6RR85UYT,B00062NHH0,Texas Fish,"நான் தினமும் வேலைக்கு undershirt போவேன். இவைகள் டாப் குவாலிட்டி. சிலர் பெரியதாக இருக்கும் என்று சொன்னாலும், எனக்கு சரியாகப் பொருந்துகிறது. கொஞ்சம் லூஸா இருந்தா நல்லது, சுத்திய பிறகு சுருங்கிவிடும். இந்த ஷர்ட்ஸ் சுமார் 6 வருடமா use பண்ணுறேன், ஒவ்வொரு ஷர்டும் 18 மாதம் வரை நீடிக்கும். குவாலிட்டி பிரச்சனை ஒருபோதும் இல்ல.",Great Undershirt,1405814400,X-Large,White,,,,,,
3,FALSE,"07 18, 2014",A2LEGDDZFEPSG0,B00062NHH0,BS,I normally wear a large. This shirt in a large is what the industry would call XL or XXL. buy accordingly.,These shirts run HUGE,1405641600,Large,White,,,,,,
5,TRUE,"07 18, 2014",AFN3HIR6B08R4,B00062NHH0,CalvinChu,"I bought this on sale and this is one of the best purchase I ever made on Amazon!  The shirt is 100% cotton so it's very soft, not too thick and not too thin.  The quality is just perfect!  Also, I'm glad that I didn't listen to most Amazon reviewers, the size is as advertised, it is not running large.",Great quality + great price = great product !,1405641600,Large,Black,,,,,,
5,TRUE,"07 16, 2014",A20V36WBAP7KN9,B00062NHH0,Aliceinsz,good,good,1405468800,Medium,White,,,,,,
5,TRUE,"07 16, 2014",A3FPW627ONPX2L,B00062NHH0,the og one,a little large but very soft and comfortable.,somewhat large,1405468800,X-Large,White/Black/Heather Grey,,,,,,
5,TRUE,"07 15, 2014",A1JHLWA4P5KIB7,B00062NHH0,Thiago Figueira,I liked a lot these t-shirts... they are very confortable and fit very well in the body.,Confortable!,1405382400,Medium,White/Black/Heather Grey,,,,,,
5,TRUE,"07 14, 2014",AI0ON25OP5387,B00062NHH0,M Russell,"Nice to wear under dark shirts and can pass as a polo shirt in a pinch. Very good construction and stitching, which is appreciated as some off brands (with lower prices) can't stand the test of time or multiple washes. In the end quality is less expensive, as you don't have to replace shirts as often, due to separated seams or fraying at the V point in the shirt.",In the long  run quality is less expensive!,1405296000,X-Large,Black,,,,,,
2,TRUE,"07 14, 2014",A1U8MAYFQ43NJJ,B00062NHH0,Xiaohan wang,they are larger than a usual L,Two Stars,1405296000,Large,Black,,,,,,
5,TRUE,"07 13, 2014",ACH16TO26X7B8,B00062NHH0,Jackie,"Nice product,worth the price",Five Stars,1405209600,Medium,Black,,,,,,
5,TRUE,"07 13, 2014",A2E51XY5TK6ZJB,B00062NHH0,Ariel Hurtado Rodrguez,Buenisimas,Five Stars,1405209600,Medium,White,,,,,,
5,TRUE,"07 13, 2014",A1DPJVRW2ZK4ZA,B00062NHH0,Michael M. Rivers,"Tese shirts are so soft and comfortable. Great colors, as well.","Soft, comfortable T-shirts",1405209600,X-Large,Blue Depths,,,,,,
5,TRUE,"07 13, 2014",A2RBDC0P8ZXFQY,B00062NHH0,Kindle Customer,I really like these undershirts.  I have purchased them multiple times.  Very comfortable and they are well made.  They keep their true white color far better than other shirts I have purchased.,Love these shirts,1405209600,Medium,White,,,,,,
4,TRUE,"07 13, 2014",A3RFHZQS4FB901,B00062NHH0,Renfeng Chen,Ok,Four Stars,1405209600,Small,Black,,,,,,
5,TRUE,"07 12, 2014",AYVN37E7YIYW4,B00062NHH0,danguo,"My friend 186 75kg
Little large",Five Stars,1405123200,Medium,Black,,,,,,
3,TRUE,"07 12, 2014",A8GZ2YEY4ECB6,B00062NHH0,lovebun,"too lager. I'm 188cm, 90kg.",Three Stars,1405123200,X-Large,Black,,,,,,
3,TRUE,"07 12, 2014",A1FCFOTL3MGX6R,B00062NHH0,ZHANG LUOWEN,i am 180cm 160lbs but it too large for me,Three Stars,1405123200,Medium,White,,,,,,
5,FALSE,"07 12, 2014",A33GJDTD51BXN1,B00062NHH0,Marcos Rocha Awad,Ok,Five Stars,1405123200,Medium,Blue Depths,,,,,,
4,TRUE,"07 11, 2014",A2YKG2NBWCIY1I,B00062NHH0,Mike G. PD for life,Nice shirts,Four Stars,1405036800,X-Large,White,,,,,,
5,TRUE,"07 10, 2014",A35FX1XYMRO6EC,B00062NHH0,Jonathan C.,"Real nice undershirts.  Soft and they are longer which helps them stay tucked in. I like these better than fruit of the loom or hanes. Also, I started tucking my undershirts into my underwear to keep them tucked in. I just hate when the undershirt gets un-tucked and your dress shit does not. Then I get this weird bulge around my waste. These are the best undershirts I've tried tho.",Great shirts,1404950400,Small,White,,,,,,
4,TRUE,"07 10, 2014",A39YQSZGG7POHB,B00062NHH0,Edith Quishpe,Excelent product,Four Stars,1404950400,Small,White/Black/Heather Grey,,,,,,
5,TRUE,"07 08, 2014",A2JXQMFTC77G4U,B00062NHH0,william,good,Five Stars,1404777600,Small,White/Black/Heather Grey,,,,,,
5,TRUE,"07 08, 2014",A1V0E9IOP34DI6,B00062NHH0,Fay,My boyfriend loves these V necks and I can never find them in stores like marshalls and tj max in his size so we ordered them online. Perfect,... necks and I can never find them in stores like marshalls and tj max in his size so we ...,1404777600,Medium,Black,,,,,,
5,TRUE,"07 07, 2014",A2TNZ1ZC7YFPTT,B00062NHH0,SOS,I buy three V necks to wear around the house every year. Last year I bought these shirts in Large and White. They were a bit bigger than I wanted and got dirty quickly. This year I bought Medium and Black. The fit is great, not too tight in the stomach area or shoulders. I am average build and wear a 42 long suit coat. These shirts are great. Hopefully they do not fade too much from weekly washing. I will check back in if there is anything to report down the road.,"6' 2"" 195 lbs = Medium",1404691200,Medium,Black,,,,,
5,TRUE,"07 07, 2014",A3R2U3J37CHNMF,B00062NHH0,adam czaja,Very good :D,Very good:,1404691200,X-Large,White,,,,,,
2,TRUE,"07 07, 2014",A17MIDPG63OIYE,B00062NHH0,bruce,The size is two x bigger than what it should be,Two Stars,1404691200,X-Large,Black,,,,,,
2,TRUE,"07 06, 2014",AVF2VTG8J3KMQ,B00062NHH0,Carlos Sarmiento,Bad quality. Too big. Does not seem as Calvin Klein product,Bad quality. too big,1404604800,Large,White,,,,,,
5,TRUE,"07 06, 2014",A1QKMMWF177BLO,B00062NHH0,Roman_Pertsovskiy,Good T-shirts,Thanks!,1404604800,Small,White/Black/Heather Grey,,,,,,
1,TRUE,"07 03, 2014",A26GLAWRDGZUWK,B00062NHH0,Haibo Zhao,2 sizes bigger than usual,to big!!!,1404345600,Large,White/Black/Heather Grey,,,,,,
4,TRUE,"07 02, 2014",A218QZU7EVWUFH,B00062NHH0,Michael Dixon,I've only worn them once after they've gone through the wash and dryer.  They don't fit tight like some of the stretch Calvin Klein or similar v-neck I've been looking for but they are definitely quality and are what I was expecting to buy.  Calvin Klein also makes the best boxer briefs I own.  Would recommend.,They don't fit tight like some of the stretch Calvin Klein or similar v-neck ...,1404259200,X-Large,White/Black/Heather Grey,,,,,,
1,TRUE,"06 30, 2014",A2CBIEK1U07IEF,B00062NHH0,vagamo,I purchased the same T's from Macy's which were made in Haiti and they were twice as thick. These are made in Bangladesh. They are thinner than the one's I just threw away. I would only recommend these to my boss.,Material is way too thin.,1404086400,Large,White,14,,,,,
1,FALSE,"06 26, 2014",A21DD6D67W6SR3,B00062NHH0,David A. Thomas,"The problem with this v neck is simple: The ""v"" is not nearly deep enough. I wear a v neck in order to have the comfort of a tshirt without letting everyone know I am wearing one--otherwise I'd buy a crew neck. I've literally taken the scissors to these things to get them so they don't show when I wear them with more casual sport shirts. Unless you are only going to wear them with dress shirts and only the very top button undone, get something else. Don't let the brand name deceive you here.",Not deep enough,1403740800,,,2,,,,,
5,TRUE,"06 25, 2014",AC48762IRZYV9,B00062NHH0,raphaelchagas,"Beautiful color, perfect size. I buyed size LARGE.
This beautiful t shirt and nice brand. Calvin Klein always with nice shirts.",Nice t-Shirts,1403654400,Large,White/Black/Heather Grey,,,,,,
5,FALSE,"06 24, 2014",A2EY66KUZHLWF6,B00062NHH0,hugh0451,"The size fits well around to me ,The quality is somewhat cheap. But worth the price. It is the perfect size .",Calvin Klein Men's Three-Pack Classic V-Neck Tee (Apparel),1403568000,Large,Black,,,,,,
5,TRUE,"06 18, 2014",A2HCZ8YXBTHDQU,B00062NHH0,Jake,"I wear these all the time for work and play. They fit a little big at first, but as my beer belly grows they are snugging up perfectly.",Great,1403049600,Large,Black,,,,,,
4,TRUE,"06 18, 2014",A2GQ4283XGM4XR,B00062NHH0,Ronald T Harris,"The shirts fit good and the material feels sturdy and feels like they are going to be long lasting wear, I'd like to say:  Thank you to the makers of these fine shirts...",GOOD QUALITY & FIT,1403049600,X-Large,Black,,,,,,
5,TRUE,"06 16, 2014",AAKLGFGXEYK72,B00062NHH0,Joyce A. Ramirez,These t-shirts are nice enough to wear as shirts with shorts for hot weather.  They wash up wear and the colors go with any pair of shorts.,Easy wear V-neck T-shirts,1402876800,X-Large,White/Black/Heather Grey,,,,,,
5,TRUE,"06 12, 2014",A1YD9GYRB6NSC2,B00062NHH0,Fengrui Tian,"I bought it for my boyfriend, and he likes it very much. It fit him a lot, and very cool for summer.",Great,1402531200,Large,White,,,,,,
5,TRUE,"06 05, 2014",ASLWZ0VPL5A8Q,B00062NHH0,Barbara Morris,"Many t-shirts are thin and flimsy or at the other end, too heavy. These are just right and the quality overall is excellent.",Good quality,1401926400,X-Large,White,,,,,,
3,TRUE,"06 04, 2014",AX67LO87FD3WG,B00062NHH0,Mark,"I've ordered this shirt pack twice. The first order was in early 2014, then again on June 4th, 2014. The shirts in the first order were correctly sized while in the second order they were much bigger. The cause of this is probably because of a change in manufacturing location that could be seen on the shirt collar. The shirts in the first order were made in Haiti while the second order was made in Bangladesh.",Needs better quality control,1401840000,Large,White,10,,,,,
5,TRUE,"06 02, 2014",A3FK7A07L5ER0U,B00062NHH0,David Webb,"Can't beat the price for CKlein T's  on Amazon, not as soft as older versions but very durable. A bit longer than expected.",Great T's,1401667200,Large,White,,,,,,
5,TRUE,"06 02, 2014",A2CFAYBN2FV9DS,B00062NHH0,lytskv,"It fits as expected, and the material is soft and comfortable.  I would definitely recommend it for an undershirt or sleeping.",Very soft and comfortable,1401667200,Medium,Black,,,,,,
5,TRUE,"06 01, 2014",A21J84P31D9KC9,B00062NHH0,zhangwen,"Calvin Klein Men's 3-Pack Classic V-Neck T-Shirt, White
The right size!
The right size! Reliable quality! I love it. I hope you will buy.",Calvin Klein Men's 3-Pack Classic V-Neck T-Shirt,1401580800,Small,White,,,,,,
5,TRUE,"05 31, 2014",A2NZ0JIWCM69QF,B00062NHH0,Doug (Nine),"Excellent, showed up on time. Well made, didn't shrink or fade so far. Definitely will buy again. And again. And again!",Excellent Tees,1401494400,X-Large,Blue Depths,,,,,,
5,TRUE,"05 28, 2014",A2D253OTUSM7BW,B00062NHH0,Dave  Amoroso,All of my shirts are XL and these are actually slightly big. they got fine with a few washes though and are very comfortable,Like em,1401235200,X-Large,White,,,,,,
2,TRUE,"05 27, 2014",A2TW4XZTUAWZU8,B00062NHH0,EarlTubesocks,"I am 6'2"" 180 lbs. I bought the mediums. They fit like XXL. Returned and bought ralph lauren v neck and they fit perfect.",Way too Big,1401148800,Medium,White,2,,,,,
5,TRUE,"05 26, 2014",A2Q52M62JV05LY,B00062NHH0,icasual,I've tried these on a few times before buying them. I must have tried different standard white v-necks as one medium seems to fit a lot tighter (which is desired for an undershirt) than others. I bought another two sets from Marshalls and they appeared to be the exact same product but fit a lot looser. They are very comfortable and I kept both.,"Great undershirts, constancy questionable?",1401062400,Medium,White,,,,,,
2,TRUE,"05 25, 2014",A18EQPTUINFYJQ,B00062NHH0,Amazon Customer,"I am long in the torso and this T-shirt is shorter than size large by some other brands.  It's too skimpy for me but if it were 2"" longer, I'd buy more because otherwise it's a good shirt.",large size is too short for a long torso,1400976000,Large,White,,,,,,
4,TRUE,"05 20, 2014",A1N5958YPPMIF4,B00062NHH0,gaurav singh,"The Shirts are a great fit. No doubt about that. However, I feel they are not very durable. It might get worn out soon. However, I will have to wait and see that.",Good quality,1400544000,Small,White/Black/Heather Grey,,,,,,
2,TRUE,"05 20, 2014",A2ROTIDVHD6D0A,B00062NHH0,Arthur,"as a Chinese,it's too wider for me,but the length is ok,just not my type. So if you're a big man,it's for you.",too wider,1400544000,Medium,Black,,,,,,
4,TRUE,"05 18, 2014",A1DOX9D9V44XY7,B00062NHH0,georgina,I think it's a good idea to spend more money on things that you use all the time. This feels SO nice and my husband gas been using as nightshirts with sweats and I love how soft they are .,"silky, worth the splurge",1400371200,Medium,White,,,,,,
5,TRUE,"05 18, 2014",A3UW3PSWZELGGE,B00062NHH0,Freddie M.,"I can't complain about anything it was all to my liking i must say when it come's to Amazon Prime it set the mode right for everything to fall in line and for that i am thankful for ""Amazon Prime"" thank you ""Prime""keep up the Good Stuff",nice,1400371200,Large,Black,,,,,,
5,TRUE,"05 14, 2014",AFKYU3N78DF5M,B00062NHH0,Kathleen Sullivan,"I bought them for my boyfriend. He is a body builder and has a good sized upper body. These shirts fit him nicely. Not too tight and not too small. He loved the look and feel, oh and so do I! For the money, they are a great value. I'm debating on buying the 3-pack of blue V-necks too!",Good Quality,1400025600,Large,White/Black/Heather Grey,,,,,,
4,TRUE,"05 13, 2014",A2U7SSQPQLCICI,B00062NHH0,Jason Chamberlain,"Comfortable and high quality. A little long at first, but I know from experience they'll shrink a little to a perfect fit..",Reliable t-shirts,1399939200,Large,White,,,,,,
4,FALSE,"05 13, 2014",A1G7NGHIMEV535,B00062NHH0,wuhuayong,"My height is 178 cm, weight 90 kg, M number just purchased. This dress is cotton, but after a little deformed after washing neckline.",I like it,1399939200,Medium,White,,,,,,
4,TRUE,"05 12, 2014",A3EV0ADY9QXG5T,B00062NHH0,none required,Performs as advertised. It's freaking underwear - you buy the right size and it fits. What more can be said?,Fits,1399852800,Medium,Black,,,,,,
4,TRUE,"05 12, 2014",A1HQWX7IJ33UU8,B00062NHH0,Ryan B.,"Great undershirt to consider making part of your wardrobe, that doesn't fade too quickly (too yellow, that is) and does not cost you an arm and leg for something that's considered a basic-necessity in a civilized world.",Great Standard,1399852800,Large,White,,,,,,
5,TRUE,"05 10, 2014",A16EJJEAWOUNKV,B00062NHH0,switzertex,"These shirts are luxuriously soft. The fabric is a little thin, but I live in a warm climate and only wear them as undershirts. They are much softer than the Hanes shirts I bought recently. I will buy only these from now on.",Super SOFT!,1399680000,Medium,White,,,,,,
5,TRUE,"05 08, 2014",ASQTEGWGPSA9,B00062NHH0,Jason,I took these out of the package and they seemed to be a few inches too long and about an inch too wide. I put them through the wash on a warm cycle and they came out fitting exactly as a medium should fit.,"A bit large at first, but fit perfectly after a wash.",1399507200,Medium,White,,,,,,
5,FALSE,"05 08, 2014",A1OALVE9I8K1ZD,B00062NHH0,shawty,"Nice cool and comfortable shirt. Use it as an undershirt for work, keeps you cool and breathable. Definitely buy some more.",comfortable,1399507200,Medium,Black,,,,,,
5,TRUE,"05 06, 2014",A9VVT49HL0D48,B00062NHH0,SHERELL,These undershirts are a must have for any man who likes comfort and that clean feeling. my husband is very particular about his under clothes and these are great. the material is soft and it fits just right,must have,1399334400,Large,White,,,,,,
4,TRUE,"05 05, 2014",A2T8I3A0DSZAOI,B00062NHH0,Ico,"Nice shirts, nice quality but I wish I hadn't listened to the reviews that said the shirts run large. I normally wear a large but I ordered size medium based on reviews that advised me to do so. Well, I need a size Large. I'll be ordering more in my actual size.","Shirts ""do not"" run large",1399248000,Medium,Black,,,,,,
5,TRUE,"05 02, 2014",A1050XS5BK823I,B00062NHH0,Cal,"I love these V neck shirts. The fitted look is good. The sleeves are a little tight, but not to where I think I am going to tear them. They don't wear out quickly.",I love these,1398988800,Medium,Black,,,,,,
5,TRUE,"04 29, 2014",AAZWYHQMWJG19,B00062NHH0,Arnie Berkins,"very happy with my purchase.
Hope you keep them in stock for the future. Also
like the three pack of black v-necks!",Great 3 packs!,1398729600,Large,Blue Depths,,,,,,
4,TRUE,"04 26, 2014",A4023UKG02EOL,B00062NHH0,Javier Cuenca,"i like so much this t-shirt. Calvin Kein is one of my favorite brand, for sure i will buy in a future.",great,1398470400,Small,White/Black/Heather Grey,,,,,,
3,TRUE,"04 25, 2014",AIT1LLE8VOFFP,B00062NHH0,J. Defreitas,"The cotton is fine, the thickness is fine but the length is easily 4 inches too long.  They need to trim 4 inches and it would be perfect.","It's just Okay, but like others have said they are too Long.",1398384000,,,,,,,,
3,TRUE,"04 23, 2014",A1PRLKJQ6QQNI7,B00062NHH0,Jose Pinochet,"the material is ok, but is too large, is recomender the refer the size in a additional table, 185 cm and 85 kg",size,1398211200,Medium,White,,,,,,
5,TRUE,"04 17, 2014",A9V1GSY0B8YEM,B00062NHH0,Fajrdrako,"Best T-shirts ever: they are comfortable,they  look good, they fit well, and are suitable for many occasions. A good price for comfortable and attractive clothing.",Enthusiastically recommended,1397692800,Large,Black,,,,,,
1,TRUE,"04 17, 2014",A1B8U28JTXCHJU,B00062NHH0,Eddie Mercado,Fit me too big. I want to return for a smaller size. Shirts run bigger so I recommend you get a size smaller then your normal.,Shirts run bigger then normal. I recommend you get one size smaller then your normal.,1397692800,X-Large,Black,,,,,,
5,TRUE,"04 16, 2014",A1DE51NW1PKCJ3,B00062NHH0,John E Speakman,"Fits so good againsst my ssssskin sso sssoft.  Mmm...makes me want to role around on my bed in nothing but this shirt,  Seriously, it fits well, looks good, hangs well, very soft.  Don't be surprised about how this it is.  The thinness is exactly what I was looking for but others may not.  I will definitely buy more some day.  Not for awhile though...the last set of three I bout 12 years ago I'm still wearing around the house as my comfy pj top.",Mmmmm !,1397606400,Large,White/Black/Heather Grey,,,,,,
5,TRUE,"04 15, 2014",A1LCNK5FWF419Z,B00062NHH0,Alberto,I love the cut of these T-shirts. I will be buying again. By the way the colors are awesome. Thanks,quick delivery,1397520000,X-Large,White/Black/Heather Grey,,,,,,
5,TRUE,"04 13, 2014",A1LZ34JJOMEQZ4,B00062NHH0,Amazon Customer,"The cotton is very comfortable, the size is also fit. My husband like this brand very much. We will buy again.",fit size,1397347200,Medium,Blue Depths,,,,,,
5,TRUE,"04 06, 2014",A19I2ER73FE091,B00062NHH0,isilent,"i think it's a little  thin, nipple could be seen clearly.but it's ok.
the quality is good,the shape is good..",good,1396742400,Small,White,,,,,,
5,TRUE,"03 28, 2014",A26TISHTBQH27Q,B00062NHH0,Lee Berg,Calvin Klein products always deliver.  The T's fit perfect.  I've bought many CK products and they all fit and work perfectly.,CK products,1395964800,X-Large,White,,,,,,
3,TRUE,"03 28, 2014",A3UZXKS24JT2EL,B00062NHH0,Belle427B,"It is difficult to find Calvin Klein XL shirts around here, and the larges are a bit too short for my tall boyfriend. These fit great and are true to CK quality. However, I ordered the 3-pack with darker grey and blue, and I received black, white, and light gray. That is my only complaint about this order. Other than that, it was a great buy.
If I had received colors ordered, I would rate 5 stars.",Shirts were great but 3-pack did not come in colors ordered,1395964800,X-Large,White/Black/Heather Grey,,,,,,
5,FALSE,"03 28, 2014",ANTNCLKB1UBO2,B00062NHH0,Alex Lee,"These T-shirts are a great value. Have been buying them over the years and find they hold up much better than other brands. And purchased through Amazon, they are a great deal as well.",great value,1395964800,X-Large,White/Black/Heather Grey,,,,,,
3,TRUE,"03 20, 2014",A28IBDJ4U567O4,B00062NHH0,ruantao,"It is too large to wearI will wear it when I sleepI buy it for it named CK, whatever ,....",Too big to wear,1395273600,Medium,White,,,,,,
4,TRUE,"03 18, 2014",A2FITEUJNJ4WH2,B00062NHH0,Meh,"Nice fabric, very fresh, however does seems to run a little big. I order a medium being a 6ft guy however next time (there will be a next time) i'm buying them small",Nice,1395100800,Medium,White/Black/Heather Grey,,,,,,
4,TRUE,"03 17, 2014",A3I2OKHQ924TDE,B00062NHH0,jermmywall,I got 3 of these sets and I really regret it. They were much longer than expected. It almost seems a 'tall' size. Very disappointed that amazon does not clearly state that.,i like it,1395014400,Large,Black,,,,,,
5,TRUE,"03 17, 2014",A254R4LGME5SHN,B00062NHH0,Randall Hawkins,"These are the only brand I wear, the most comfortable. Highly recommend. They hold up nice in the wash as well",the best,1395014400,X-Large,White,,,,,,
5,TRUE,"03 17, 2014",AVL7PKDTRU4OV,B00062NHH0,guoxiangyu,"Clothes quality is very good, suitable for 170-175 cm tall, weighs75 kg of the following figure, the item is consistent with the description, logistics speed is very fast, I like it very much. Next time I will continue to buy the product.",fit,1395014400,Small,White/Black/Heather Grey,,,,,,
5,TRUE,"03 15, 2014",A20YTIIVK1E7WN,B00062NHH0,Michael Zhao,"I bought these for the price. They are good, soft and comfortable! When needed I will buy again! Very nice!",They are nice and cheap,1394841600,Medium,White,,,,,,
5,TRUE,"03 13, 2014",A3C3M0HOS2QUAE,B00062NHH0,Damien E. P.,"Great material. Unexpectedly long, but this means it'll stayed tucked in -- like an undershirt should. I'd prefer it tighter as an undershirt but right now it's just really comfortable.","Great material, stays tucked in",1394668800,Small,White/Black/Heather Grey,,,,,,
1,TRUE,"03 12, 2014",A36LKTQ84HFYEQ,B00062NHH0,Lee Jay,"The quality of this product is disappointed, add to that, this is made for big guys
I am 5""9 tall and wide shoulder, but' too big for me",Too big,1394582400,Large,White,4,,,,,
4,TRUE,"03 12, 2014",ATKHPW18B6CAF,B00062NHH0,Gnatwon,"Bought these for my son as a Christmas gift and he wears them all the time.  They wash well and are nice and soft, these colors are hard to find these days so if you get lucky and find them, buy them!",Great Colors in Calvin Klein T's,1394582400,X-Large,Blue Depths,,,,,,
4,TRUE,"03 12, 2014",A39OAVUKRF68RA,B00062NHH0,single dad,"they are just nice cottony, good feel, v necks as described.  if you like v necks, do it.  no problems, launder nicely",really nice v-necks,1394582400,Large,Blue Depths,,,,,,
4,TRUE,"03 11, 2014",AQLZUUS2WBQPR,B00062NHH0,JR,"Long enough to stay tucked in, and snug enough so there is no bunching. The v-neck is about as deep as the second button on most dress shirts. Better quality material and stitching than cheaper brands.","Good, just snug enough fit",1394496000,Large,White,,,,,,
3,TRUE,"03 10, 2014",A3P70EQO08T7XR,B00062NHH0,Angel,"If you like the slim fit kind of shirt this is not the one you should buy. Other than that, cotton feels nice.",Wider than Expected,1394409600,Large,White,,,,,,
5,TRUE,"03 10, 2014",A1DPGEMQ2IPVE6,B00062NHH0,tjis cool,They fit my son prefect it just what he wanted thank you.. I will keep on buying from Calvin Klein,it was a prefect fit,1394409600,Medium,White,,,,,,
5,TRUE,"03 08, 2014",A16HIZQRLSB938,B00062NHH0,Gustav B.,Having bought many sleeping shirts before. These top all of them before in terms of tactile feel and quality. It's a dream to wear them to bed.,Excellent quality! Very soft.,1394236800,Medium,White/Black/Heather Grey,,,,,,
5,TRUE,"03 05, 2014",A2FEQ5XB73IMT6,B00062NHH0,dennis kirkland,do you have any more at that price? thanks.thought they might be a little big but they were just right,WISH I HAD GOTTON MORE AT THAT PRICE,1393977600,X-Large,White/Black/Heather Grey,,,,,,
5,TRUE,"03 04, 2014",A22AEA0PVY8GUM,B00062NHH0,gjcksc,These shirts are very comfortable!  The colors are very vibrant!  So far they haven't lost their shape.  Nice to wear as an undershirt or nightshirt.,Nice,1393891200,X-Large,Blue Depths,,,,,,
5,TRUE,"02 28, 2014",A2LVJ37JT3NQ6Z,B00062NHH0,Mary Kinney,"These are some of the best tshirts on the market.  So glad I found them on Amazon.  Smooth, comfortable and good fit.",Excellent product,1393545600,Large,White,,,,,,
5,TRUE,"02 24, 2014",A9PL1VEDAALS0,B00062NHH0,TimT,These are excellent shirts. They are definitely for under clothing wear. The quality of the fabric and construction far outshine anything I've purchased in the last 15 years. Do yourself a favor. Buy them. The cheap variety are more expensive in the long run than these shirts.,Wish I'd bought these years ago...,1393200000,Large,White/Black/Heather Grey,,,,,,
5,TRUE,"02 18, 2014",A174NYS7K8Q24K,B00062NHH0,C Baker,"My husband wears these under his work shirts and around the house as pajamas. They're soft, comfortable and tag free. Very pleased.",great,1392681600,Large,White,,,,,,
